<?xml version="1.0" encoding="UTF-8"?>
<!-- XML Document that conforms to StudentsSchema.xsd and holds 10 student records -->
<Datasheet xmlns:xsi="http://www.w3.org/2001/XMLSchema-instance"
           xsi:noNamespaceSchemaLocation="StudentsSchema.xsd">
    <!-- Individual student records -->
    <Student_Info>
        <Rollno>10000</Rollno>
        <Name>AAAAAAAAAA</Name>
        <Gender>Male</Gender>
        <Degree>B.E</Degree>
        <Discipline>Computer Science and Engineering</Discipline>
        <Batch>2013-2017</Batch>
        <Year>III</Year>
        <Semester>5</Semester>
    </Student_Info>
    <Student_Info>
        <Rollno>10100</Rollno>
        <Name>BBBBBBBBB</Name>
        <Gender>Male</Gender>
        <Degree>B.E</Degree>
        <Discipline>Electronics and Communication</Discipline>
        <Batch>2013-2017</Batch>
        <Year>III</Year>
        <Semester>5</Semester>
    </Student_Info>
    <Student_Info>
        <Rollno>10200</Rollno>
        <Name>CCCCCCCCCC</Name>
        <Gender>Male</Gender>
        <Degree>B.E</Degree>
        <Discipline>Electrical and Electronics Engineering</Discipline>
        <Batch>2013-2017</Batch>
        <Year>III</Year>
        <Semester>5</Semester>
    </Student_Info>
    <Student_Info>
        <Rollno>10300</Rollno>
        <Name>DDDDDDDDDD</Name>
        <Gender>Male</Gender>
        <Degree>B.E</Degree>
        <Discipline>Civil Engineering</Discipline>
        <Batch>2013-2017</Batch>
        <Year>III</Year>
        <Semester>5</Semester>
    </Student_Info>
    <Student_Info>
        <Rollno>10400</Rollno>
        <Name>EEEEEEEEEE</Name>
        <Gender>Male</Gender>
        <Degree>B.Tech</Degree>
        <Discipline>Information Technology</Discipline>
        <Batch>2013-2017</Batch>
        <Year>III</Year>
        <Semester>5</Semester>
    </Student_Info>
    <Student_Info>
        <Rollno>10500</Rollno>
        <Name>FFFFFFFFFF</Name>
        <Gender>Female</Gender>
        <Degree>B.E</Degree>
        <Discipline>Computer Science and Engineering</Discipline>
        <Batch>2013-2017</Batch>
        <Year>III</Year>
        <Semester>5</Semester>
    </Student_Info>
    <Student_Info>
        <Rollno>10600</Rollno>
        <Name>GGGGGGGGGG</Name>
        <Gender>Female</Gender>
        <Degree>B.E</Degree>
        <Discipline>Electronics and Communication</Discipline>
        <Batch>2013-2017</Batch>
        <Year>III</Year>
        <Semester>5</Semester>
    </Student_Info>
    <Student_Info>
        <Rollno>10700</Rollno>
        <Name>HHHHHHHHHHH</Name>
        <Gender>Female</Gender>
        <Degree>B.E</Degree>
        <Discipline>Electrical and Electronics Engineering</Discipline>
        <Batch>2013-2017</Batch>
        <Year>III</Year>
        <Semester>5</Semester>
    </Student_Info>
    <Student_Info>
        <Rollno>10800</Rollno>
        <Name>IIIIIIIIII</Name>
        <Gender>Female</Gender>
        <Degree>B.E</Degree>
        <Discipline>Civil Engineering</Discipline>
        <Batch>2013-2017</Batch>
        <Year>III</Year>
        <Semester>5</Semester>
    </Student_Info>
    <Student_Info>
        <Rollno>10900</Rollno>
        <Name>JJJJJJJJJJ</Name>
        <Gender>Female</Gender>
        <Degree>B.Tech</Degree>
        <Discipline>Information Technology</Discipline>
        <Batch>2013-2017</Batch>
        <Year>III</Year>
        <Semester>5</Semester>
    </Student_Info>
</Datasheet>
